{
    "format": "pddlica-execution",
    "steps": [
        {
            "kind": "planned_happening",
            "post_state": {
                "presence": {
                    "transfer": true,
                    "destination": true,
                    "source": true
                },
                "interface": {
                    "transfer.outlet.pressure": 1,
                    "transfer.inlet.mass-flow": 1.0000000000000002,
                    "destination.inlet.pressure": 0.9999999999999999,
                    "source.outlet.mass-flow": -1.0000000000000002,
                    "source.inlet.pressure": 1.0000000000000004,
                    "destination.inlet.mass-flow": 1,
                    "transfer.inlet.pressure": 1,
                    "destination.outlet.pressure": 0.9999999999999999,
                    "transfer.outlet.mass-flow": -0.9999999999999997,
                    "source.inlet.mass-flow": -3.0531133177191805e-16,
                    "destination.outlet.mass-flow": 0,
                    "source.outlet.pressure": 1
                },
                "time": "0.0",
                "microstep": 0,
                "stored": {
                    "source.capacity": 20,
                    "destination.capacity": 20,
                    "source.internal-pressure": 1,
                    "source.volume": 4.999999999999997,
                    "transfer.mode": "running",
                    "transfer.rated-flow": 1,
                    "destination.volume": 5,
                    "destination.internal-pressure": 1
                },
                "boundary_memory": {
                    "destination.outlet.pressure": 0.9999999999999999,
                    "source.inlet.pressure": 1.0000000000000007
                }
            },
            "time": 0,
            "occurrence_ids": [
                "occ/0"
            ],
            "pre_state": {
                "presence": {
                    "transfer": true,
                    "destination": true,
                    "source": true
                },
                "interface": {
                    "transfer.outlet.pressure": 1,
                    "transfer.inlet.mass-flow": 0,
                    "destination.inlet.pressure": 1,
                    "source.outlet.mass-flow": 0,
                    "source.inlet.pressure": 1,
                    "destination.inlet.mass-flow": 0,
                    "transfer.inlet.pressure": 1,
                    "destination.outlet.pressure": 1,
                    "transfer.outlet.mass-flow": 0,
                    "source.inlet.mass-flow": 0,
                    "destination.outlet.mass-flow": 0,
                    "source.outlet.pressure": 1
                },
                "time": "0.0",
                "microstep": 0,
                "stored": {
                    "source.capacity": 20,
                    "destination.capacity": 20,
                    "source.internal-pressure": 1,
                    "source.volume": 4.999999999999997,
                    "transfer.mode": "running",
                    "transfer.rated-flow": 1,
                    "destination.volume": 5,
                    "destination.internal-pressure": 1
                },
                "boundary_memory": {
                    "destination.outlet.pressure": 0.9999999999999999,
                    "source.inlet.pressure": 1.0000000000000007
                }
            }
        },
        {
            "start_time": 0,
            "kind": "continuous",
            "end_time": 5,
            "state": {
                "presence": {
                    "transfer": true,
                    "destination": true,
                    "source": true
                },
                "interface": {
                    "transfer.outlet.pressure": 0.9999999999999997,
                    "transfer.inlet.mass-flow": 1.0000000000000002,
                    "destination.inlet.pressure": 0.9999999999999997,
                    "source.outlet.mass-flow": -1.0000000000000002,
                    "source.inlet.pressure": 1.0000000000000007,
                    "destination.inlet.mass-flow": 1.0000000000000002,
                    "transfer.inlet.pressure": 1.0000000000000002,
                    "destination.outlet.pressure": 0.9999999999999999,
                    "transfer.outlet.mass-flow": -0.9999999999999998,
                    "source.inlet.mass-flow": -3.608224830031758e-16,
                    "destination.outlet.mass-flow": 0,
                    "source.outlet.pressure": 1.0000000000000002
                },
                "time": "5.0",
                "microstep": 0,
                "stored": {
                    "source.capacity": 20,
                    "destination.capacity": 20,
                    "source.internal-pressure": 1,
                    "source.volume": 4.999999999999997,
                    "transfer.mode": "running",
                    "transfer.rated-flow": 1,
                    "destination.volume": 5,
                    "destination.internal-pressure": 1
                },
                "boundary_memory": {
                    "destination.outlet.pressure": 0.9999999999999999,
                    "source.inlet.pressure": 1.0000000000000007
                }
            },
            "end_reason": "target"
        }
    ],
    "status": "valid",
    "diagnostics": [
    ],
    "metadata": {
        "absolute_tolerance": 1.0e-9,
        "trajectory_uses_solver_steps": false,
        "model_digest": "sha256:25a935dbd8666762034d31a8b6c2cfabce7dfcab43fe2063f34234bb236e9e42",
        "symbolic_regimes": 2,
        "event_tolerance": 1.0e-10,
        "relative_tolerance": 1.0e-9,
        "trajectory_interval": 0.1
    },
    "version": "0.1",
    "terminal_state": {
        "presence": {
            "transfer": true,
            "destination": true,
            "source": true
        },
        "interface": {
            "transfer.outlet.pressure": 0.9999999999999997,
            "transfer.inlet.mass-flow": 1.0000000000000002,
            "destination.inlet.pressure": 0.9999999999999997,
            "source.outlet.mass-flow": -1.0000000000000002,
            "source.inlet.pressure": 1.0000000000000007,
            "destination.inlet.mass-flow": 1.0000000000000002,
            "transfer.inlet.pressure": 1.0000000000000002,
            "destination.outlet.pressure": 0.9999999999999999,
            "transfer.outlet.mass-flow": -0.9999999999999998,
            "source.inlet.mass-flow": -3.608224830031758e-16,
            "destination.outlet.mass-flow": 0,
            "source.outlet.pressure": 1.0000000000000002
        },
        "time": "5.0",
        "microstep": 0,
        "stored": {
            "source.capacity": 20,
            "destination.capacity": 20,
            "source.internal-pressure": 1,
            "source.volume": 4.999999999999997,
            "transfer.mode": "running",
            "transfer.rated-flow": 1,
            "destination.volume": 5,
            "destination.internal-pressure": 1
        },
        "boundary_memory": {
            "destination.outlet.pressure": 0.9999999999999999,
            "source.inlet.pressure": 1.0000000000000007
        }
    },
    "trajectories": {
        "transfer.inlet.mass-flow": {
            "kind": "interface",
            "phases": [
                "initial",
                "action",
                "continuous",
                "continuous",
                "continuous",
                "continuous",
                "continuous",
                "continuous",
                "continuous",
                "continuous",
                "continuous",
                "continuous",
                "continuous",
                "continuous",
                "continuous",
                "continuous",
                "continuous",
                "continuous",
                "continuous",
                "continuous",
                "continuous",
                "continuous",
                "continuous",
                "continuous",
                "continuous",
                "continuous",
                "continuous",
                "continuous",
                "continuous",
                "continuous",
                "continuous",
                "continuous",
                "continuous",
                "continuous",
                "continuous",
                "continuous",
                "continuous",
                "continuous",
                "continuous",
                "continuous",
                "continuous",
                "continuous",
                "continuous",
                "continuous",
                "continuous",
                "continuous",
                "continuous",
                "continuous",
                "continuous",
                "continuous",
                "continuous",
                "continuous"
            ],
            "values": [
                0,
                1.0000000000000002,
                1.0000000000000002,
                1.0000000000000002,
                1.0000000000000002,
                1.0000000000000002,
                1.0000000000000002,
                1.0000000000000002,
                1.0000000000000002,
                1.0000000000000002,
                1.0000000000000002,
                1.0000000000000002,
                1.0000000000000002,
                1.0000000000000002,
                1.0000000000000002,
                1.0000000000000002,
                1.0000000000000002,
                1.0000000000000002,
                1.0000000000000002,
                1.0000000000000002,
                1.0000000000000002,
                1.0000000000000002,
                1.0000000000000002,
                1.0000000000000002,
                1.0000000000000002,
                1.0000000000000002,
                1.0000000000000002,
                1.0000000000000002,
                1.0000000000000002,